title,authors,average_rating,  num_pages,ratings_count,publication_date,publisher
Harry Potter and the Half-Blood Prince (Harry Potter  #6),J.K. Rowling/Mary GrandPré,4.57,652,2095690,9/16/2006,Scholastic Inc.
Harry Potter and the Order of the Phoenix (Harry Potter  #5),J.K. Rowling/Mary GrandPré,4.49,870,2153167,09/01/2004,Scholastic Inc.
Harry Potter and the Chamber of Secrets (Harry Potter  #2),J.K. Rowling,4.42,352,6333,11/01/2003,Scholastic Inc.
Harry Potter and the Prisoner of Azkaban (Harry Potter  #3),J.K. Rowling/Mary GrandPré,4.56,435,2339585,05/01/2004,Scholastic Inc.
Harry Potter Boxed Set  Books 1-5 (Harry Potter  #1-5),J.K. Rowling/Mary GrandPré,4.78,2690,41428,9/13/2004,Scholastic Inc.
"Unauthorized Harry Potter Book Seven News: ""Half-Blood Prince"" Analysis and Speculation",W. Frederick Zimmerman,3.74,152,19,4/26/2005,Nimble Books
Harry Potter Collection (Harry Potter  #1-6),J.K. Rowling,4.73,3342,28242,09/12/2005,Scholastic Inc.
The Ultimate Hitchhiker's Guide: Five Complete Novels and One Story (Hitchhiker's Guide to the Galaxy  #1-5),Douglas Adams,4.38,815,3628,11/01/2005,Gramercy Books
The Ultimate Hitchhiker's Guide to the Galaxy (Hitchhiker's Guide to the Galaxy  #1-5),Douglas Adams,4.38,815,249558,4/30/2002,Del Rey Books
The Hitchhiker's Guide to the Galaxy (Hitchhiker's Guide to the Galaxy  #1),Douglas Adams,4.22,215,4930,08/03/2004,Crown
The Hitchhiker's Guide to the Galaxy (Hitchhiker's Guide to the Galaxy  #1),Douglas Adams/Stephen Fry,4.22,6,1266,3/23/2005,Random House Audio
The Ultimate Hitchhiker's Guide (Hitchhiker's Guide to the Galaxy  #1-5),Douglas Adams,4.38,815,2877,1/17/1996,Wings Books
A Short History of Nearly Everything,Bill Bryson,4.21,544,248558,9/14/2004,Broadway Books
Bill Bryson's African Diary,Bill Bryson,3.44,55,7270,12/03/2002,Broadway Books
Bryson's Dictionary of Troublesome Words: A Writer's Guide to Getting It Right,Bill Bryson,3.87,256,2088,9/14/2004,Broadway Books
In a Sunburned Country,Bill Bryson,4.07,335,72451,5/15/2001,Broadway Books
I'm a Stranger Here Myself: Notes on Returning to America After Twenty Years Away,Bill Bryson,3.9,304,49240,6/28/2000,Broadway Books
The Lost Continent: Travels in Small Town America,Bill Bryson,3.83,299,45712,8/28/1990,William Morrow Paperbacks
Neither Here nor There: Travels in Europe,Bill Bryson,3.86,254,48701,3/28/1993,William Morrow Paperbacks
Notes from a Small Island,Bill Bryson,3.91,324,80609,5/28/1997,William Morrow Paperbacks
The Mother Tongue: English and How It Got That Way,Bill Bryson,3.93,270,28489,9/28/1991,William Morrow Paperbacks
J.R.R. Tolkien 4-Book Boxed Set: The Hobbit and The Lord of the Rings,J.R.R. Tolkien,4.59,1728,101233,9/25/2012,Ballantine Books
The Lord of the Rings (The Lord of the Rings  #1-3),J.R.R. Tolkien,4.5,1184,1710,10/21/2004,Houghton Mifflin Harcourt
The Fellowship of the Ring (The Lord of the Rings  #1),J.R.R. Tolkien,4.36,398,2128944,09/05/2003,Houghton Mifflin Harcourt
The Lord of the Rings (The Lord of the Rings  #1-3),J.R.R. Tolkien/Alan  Lee,4.5,1216,1618,10/01/2002,Houghton Mifflin Harcourt
The Lord of the Rings: Weapons and Warfare,Chris   Smith/Christopher  Lee/Richard Taylor,4.53,218,19822,11/05/2003,Houghton Mifflin Harcourt
The Lord of the Rings: Complete Visual Companion,Jude Fisher,4.5,224,359,11/15/2004,Houghton Mifflin Harcourt
Agile Web Development with Rails: A Pragmatic Guide,Dave Thomas/David Heinemeier Hansson/Leon Breedt/Mike Clark/Thomas  Fuchs/Andreas  Schwarz,3.84,558,1430,7/28/2005,Pragmatic Bookshelf
Hatchet (Brian's Saga  #1),Gary Paulsen,3.72,208,270244,04/01/2000,Atheneum Books for Young Readers: Richard Jackson Books
"Hatchet: A Guide for Using ""Hatchet"" in the Classroom",Donna Ickes/Edward Sciranko/Keith Vasconcelles,4,48,36,8/28/1994,Teacher Created Resources
Guts: The True Stories behind Hatchet and the Brian Books,Gary Paulsen,3.88,144,2067,1/23/2001,Delacorte Press
Molly Hatchet - 5 of the Best,Molly Hatchet,4.33,56,6,06/10/2003,Cherry Lane Music Company
Hatchet Jobs: Writings on Contemporary Fiction,Dale Peck,3.45,228,99,11/01/2005,The New Press
A Changeling for All Seasons (Changeling Seasons #1),Angela Knight/Sahara Kelly/Judy Mays/Marteeka Karland/Kate Douglas/Shelby Morgen/Lacey Savage/Kate Hill/Willa Okati,3.76,304,167,11/01/2005,Changeling Press
Changeling (Changeling  #1),Delia Sherman,3.6,256,978,8/17/2006,Viking Juvenile
The Changeling Sea,Patricia A. McKillip,4.06,137,4454,4/14/2003,Firebird
The Changeling,Zilpha Keatley Snyder,4.17,228,1176,06/08/2004,iUniverse
The Changeling,Kate Horsley,3.55,339,301,04/12/2005,Shambhala
The Changeling (Daughters of England  #15),Philippa Carr,3.98,369,345,8/28/1990,Ivy Books
The Known World,Edward P. Jones,3.83,388,29686,8/29/2006,Amistad
The Known World,Edward P. Jones/Kevin R. Free,3.83,14,55,6/15/2004,HarperAudio
The Known World,Edward P. Jones,3.83,576,22,6/15/2004,Harper
Traders  Guns & Money: Knowns and Unknowns in the Dazzling World of Derivatives,Satyajit Das,3.83,334,1456,5/15/2006,FT Press
Artesia: Adventures in the Known World,Mark Smylie,4.13,352,52,12/14/2005,Archaia
The John McPhee Reader (John McPhee Reader  #1),John McPhee/William Howarth,4.42,416,562,06/01/1982,Farrar Straus and Giroux
Uncommon Carriers,John McPhee,3.95,248,1630,5/16/2006,Farrar Straus Giroux
Heirs of General Practice,John McPhee,4.17,128,268,04/01/1986,Farrar Straus and Giroux
The Control of Nature,John McPhee,4.24,288,3498,09/01/1990,Farrar Straus and Giroux
Annals of the Former World,John McPhee,4.34,720,3115,01/06/1999,Farrar Straus and Giroux
Coming Into the Country,John McPhee,4.22,448,5704,04/01/1991,Farrar Straus and Giroux
La Place de la Concorde Suisse,John McPhee,3.92,160,698,04/01/1994,Farrar Straus and Giroux
Giving Good Weight,John McPhee,4.23,288,542,04/01/1994,Farrar Straus and Giroux
Rising from the Plains,John McPhee,4.23,208,1341,11/01/1987,Farrar Straus and Giroux
The Heidi Chronicles,Wendy Wasserstein,3.75,81,1423,03/01/2002,Dramatists Play Service
The Heidi Chronicles: Uncommon Women and Others & Isn't It Romantic,Wendy Wasserstein,3.84,249,2766,07/02/1991,Vintage
Active Literacy Across the Curriculum: Strategies for Reading  Writing  Speaking  and Listening,Heidi Hayes Jacobs,3.94,138,31,3/29/2006,Routledge
Simply Beautiful Beaded Jewelry,Heidi Boyd,3.77,128,62,3/14/2006,North Light Books
Always Enough: God's Miraculous Provision Among the Poorest Children on Earth,Heidi Baker/Rolland Baker,4.46,192,860,09/01/2003,Chosen Books
Mapping the Big Picture: Integrating Curriculum & Assessment K-12,Heidi Hayes Jacobs,3.68,108,77,1/28/1997,Association for Supervision & Curriculum Development
Heidi (Heidi  #1-2),Johanna Spyri/Beverly Cleary/Angelo  Rinaldi,3.99,352,153317,11/15/2002,Kingfisher
Getting Results with Curriculum Mapping,Heidi Hayes Jacobs,3.25,192,55,11/15/2004,ASCD
There's Always Enough: The Miraculous Move of God in Mozambique,Rolland Baker/Heidi Baker,4.46,192,34,4/28/2003,Sovereign World
What to Expect the First Year (What to Expect),Heidi Murkoff/Sharon Mazel/Arlene Eisenberg/Sandee Hathaway/Mark D. Widome,3.89,832,11797,10/16/2003,Workman Publishing Company
The Player's Handbook: The Ultimate Guide on Dating and Relationships,Heidi Fleiss/Libby Keatinge,3.82,123,34,05/10/2004,One Hour Entertainment
Simply Beautiful Beading: 53 Quick and Easy Projects,Heidi Boyd,3.78,128,78,8/19/2004,North Light Books
God Emperor of Dune (Dune Chronicles  #4),Frank Herbert,3.84,423,2785,6/15/1987,Ace Books
Chapterhouse: Dune (Dune Chronicles #6),Frank Herbert,3.91,436,38778,07/01/1987,Ace Books
Dune Messiah (Dune Chronicles #2),Frank Herbert,3.88,331,97494,7/15/1987,Ace Books
Dreamer of Dune: The Biography of Frank Herbert,Brian Herbert,4.01,592,784,07/01/2004,Tor Books
Heretics of Dune (Dune Chronicles  #5),Frank Herbert,3.86,480,272,4/16/1984,Putnam
The Road to Dune,Frank Herbert/Brian Herbert/Kevin J. Anderson,3.88,426,4789,8/29/2006,Tor Science Fiction
Heretics of Dune (Dune Chronicles #5),Frank Herbert,3.86,471,45388,8/15/1987,Ace Books
The Lord of the Rings: The Art of the Fellowship of the Ring,Gary Russell,4.59,192,26153,06/12/2002,Houghton Mifflin Harcourt
The Power of One (The Power of One  #1),Bryce Courtenay,4.35,544,69167,9/29/1996,Ballantine Books
The Power of One (The Power of One  #1),Bryce Courtenay,4.35,291,45,9/13/2005,Delacorte Books for Young Readers
The Power of One: One Person  One Rule  One Month,John C. Maxwell/Stephen R. Graves/Thomas G. Addington,4.28,256,16,11/01/2004,Thomas Nelson
Power of an Hour: Business and Life Mastery in One Hour a Week,Dave Lakhani,3.34,205,174,5/19/2006,Wiley
The Power of One: The Solo Play for Playwrights  Actors  and Directors,Louis E. Catron,3.67,240,10,02/07/2000,Heinemann Drama
How to Buy  Sell & Profit on eBay: Kick-Start Your Home-Based Business in Just Thirty Days,Adam Ginsberg,3.48,336,76,05/03/2005,William Morrow Paperbacks
eBay for Dummies,Marsha Collier,3.5,386,111,10/30/2006,Wiley
What to Sell on ebay and Where to Get It: The Definitive Guide to Product Sourcing for eBay and Beyond,Chris Malta/Lisa Suttora,3.62,260,24,1/24/2006,McGraw-Hill
Starting an eBay Business for Dummies,Marsha Collier,3.55,384,55,9/17/2004,Wiley
eBay: Top 100 Simplified Tips & Tricks,Julia Wilkinson,4.27,260,9,06/06/2006,Wiley
ebay Timesaving Techniques for Dummies,Marsha Collier,3.39,391,22,5/31/2004,Wiley
eBay Business All-in-One Desk Reference for Dummies,Marsha Collier,3.89,864,17,4/25/2005,Wiley
Ruby Cookbook,Lucas Carlson/Leonard Richardson,3.84,873,166,7/29/2006,O'Reilly Media
Ruby Ann's Down Home Trailer Park Cookbook,Ruby Ann Boxcar,4.12,240,50,05/03/2005,Citadel
Ruby Ann's Down Home Trailer Park BBQin' Cookbook,Ruby Ann Boxcar,4.08,206,13,05/03/2005,Citadel
Rails Cookbook: Recipes for Rapid Web Development with Ruby,Rob Orsini,3.48,514,64,01/01/2007,O'Reilly Media
Anna Karenina,Leo Tolstoy/Richard Pevear/Larissa Volokhonsky,4.05,838,16643,5/31/2004,Penguin Classics
Anna Karenina,Leo Tolstoy/David Magarshack/Priscilla Meyer,4.05,960,109420,11/05/2002,Signet
Anna Karenina,Leo Tolstoy/Richard Pevear/Larissa Volokhonsky/John Bayley,4.05,837,2904,1/30/2003,Penguin Books
CliffsNotes on Tolstoy's Anna Karenina,Marianne Sturman/Leo Tolstoy,3.85,80,16,11/26/1965,Cliffs Notes
Anna Karenina,Leo Tolstoy/Amy Mandelker/Constance Garnett,4.05,803,9564,07/01/2003,Barnes & Noble Classics
Anna Karenina,Leo Tolstoy/Louise Maude/Aylmer Maude,4.05,752,474,11/23/2004,Dover Publications
Anna Karenina,Leo Tolstoy/Constance Garnett/Amy Mandelker,4.05,803,303,8/26/2004,Barnes & Noble
Dinner with Anna Karenina,Gloria Goldreich,2.99,360,411,1/28/2006,Mira Books
Tolstoy: Anna Karenina,Anthony Thorlby,4.19,128,1204,11/26/1987,Cambridge University Press
Untouchable,Mulk Raj Anand/E.M. Forster,3.71,160,3429,07/03/1990,Penguin Books
The Untouchable,John Banville,3.95,367,2163,6/30/1998,Vintage
